页码,表格,纯文本
72,N_A,"工人员，单位和职工可缴存住房公积金的规定；符合国发[2006]5号解决农民工
问题的意见关于招用农民工数量较多的企业，在符合规划的前提下，可在依法
取得的企业用地范围内建设农民工集体宿舍；有条件的地方，城镇单位聘用农
民工，用人单位和个人可缴存住房公积金的相关规定。
3、以报告期各期末员工人数为基础测算，报告期内，如为全体员工缴纳社
保（抵除补贴）及住房公积金，则与公司各期实际缴纳金额的差额如下：
公司控股股东与实际控制人余春明及余超彪就股份公司及其下属控股企业
的社会保险、住房公积金相关事项作出如下承诺：“在股份公司上市后，若由于
股份公司及其下属控股企业在股份公司上市前的经营活动中存在应缴未缴的社
公司控股股东与实际控制人余春明及余超彪就股份公司及其下属控股企业
的社会保险、住房公积金相关事项作出如下承诺：“在股份公司上市后，若由于
股份公司及其下属控股企业在股份公司上市前的经营活动中存在应缴未缴的社
会保险和住房公积金而被有关政府部门要求补缴或者处罚，本人将赔偿股份公
司及其下属控股企业由此产生的损失。”
4、公司未因违反五险一金相关法律法规遭受行政处罚
2016年7月26日，旌德县人力资源和社会保障局出具《证明函》，确认公
司认真执行国家及地方有关劳动及社会保障方面的法律、法规，已依法及时、
足额缴纳职工的养老、失业、医疗、工伤及生育等社会保险金，未有欠缴记录；
其缴纳社会保险的比例和标准符合政策要求，符合我国劳动和社会保障相关法
律、法规和规范性文件的规定；公司自2013年1月1日以来，不存在因违反劳
动用工和劳动保障等方面的法律法规而受到相关主管机关处罚的情形。
2016年7月26日，宣城市住房公积金管理中心旌德管理部出具《证明函》，
确认公司已于2012年12月建立了住房公积金账户，公司从2012年9月起按5%
缴存比例为 25 名职工缴存了住房公积金，目前缴存住房公积金职工人数为 141
名，公司自2013年1月1日以来，没有因违反国家及地方住房公积金等方面的
法律法规而受到相关主管机关处罚的情形。
综上所述，发行人保荐机构和发行人律师认为，发行人在报告期内为部分
员工缴纳社保和住房公积金，并跟据员工意愿和需要提供补贴和宿舍，客观上
未实际损害员工权益，除报告期初工伤保险缴纳存在一定不规范处外，符合法
律法规的相关规定，有关主管部门亦出具了相关合规证明；同时，控股股东与
"
73,N_A,"2016年7月26日，宣城市住房公积金管理中心旌德管理部出具《证明函》，
确认公司已于2012年12月建立了住房公积金账户，公司从2012年9月起按5%
缴存比例为 25 名职工缴存了住房公积金，目前缴存住房公积金职工人数为 141
名，公司自2013年1月1日以来，没有因违反国家及地方住房公积金等方面的
法律法规而受到相关主管机关处罚的情形。
综上所述，发行人保荐机构和发行人律师认为，发行人在报告期内为部分
员工缴纳社保和住房公积金，并跟据员工意愿和需要提供补贴和宿舍，客观上
未实际损害员工权益，除报告期初工伤保险缴纳存在一定不规范处外，符合法
律法规的相关规定，有关主管部门亦出具了相关合规证明；同时，控股股东与
实际控制人已承诺就今后可能被要求补缴或处罚承担赔偿责任。因此，发行人
如需补缴社保和住房公积金金额对财务数据影响较小，且有相应的保障措施，
不致对发行人本次发行条件构成障碍。
（三）发行人劳务派遣用工的具体情况
为提高管理效率及有效保障用工需求，发行人对部分辅助性岗位采用劳务
派遣用工方式作为劳务人员的补充手段。发行人目前与旌德县金阳劳务服务有
限公司（以下简称“金阳劳务公司”）签署《劳务派遣协议书》，对双方的权
利义务进行约定。金阳劳务公司成立于2008年4月9日，注册资本200万元，
经营范围为“劳务派遣、职业中介、职业培训、劳务输出输入、劳动事务代理、
家政服务、创业服务；中小企业信息化建设服务，法律、财务咨询服务；业务
外包”，持有《劳务派遣经营许可证》（编号：34180020130005）。
根据《劳务派遣协议书》，金阳劳务公司为发行人提供符合发行人用人条
件的劳务人员和劳务派遣服务，负责向劳务派遣人员发放工资并为其缴纳社保，
发行人按月向金阳劳务公司支付被派遣劳动者工资、应由发行人承担的各项社
保费用、派遣服务费等费用，并为被派遣劳动者提供相应的劳动条件和劳动保
护。金阳劳务公司确认与发行人之间不存在纠纷或潜在纠纷。
根据发行人提供的资料及说明，劳务派遣人员享有与发行人相同或相近似
岗位正式员工相同或近似的劳动报酬和福利待遇。报告期各期期末，公司劳务
派遣用工人数及比例如下：
截至2016年6月30日，公司员工总数为674人，其中，合同员工人数618
人，劳务派遣人数56人，劳务派遣用工人数占用工总数比例降至8.31%，符合
《劳务派遣暂行规定》等相关法律法规的规定。
"
74,N_A,"根据《劳务派遣协议书》，金阳劳务公司为发行人提供符合发行人用人条
件的劳务人员和劳务派遣服务，负责向劳务派遣人员发放工资并为其缴纳社保，
发行人按月向金阳劳务公司支付被派遣劳动者工资、应由发行人承担的各项社
保费用、派遣服务费等费用，并为被派遣劳动者提供相应的劳动条件和劳动保
护。金阳劳务公司确认与发行人之间不存在纠纷或潜在纠纷。
根据发行人提供的资料及说明，劳务派遣人员享有与发行人相同或相近似
岗位正式员工相同或近似的劳动报酬和福利待遇。报告期各期期末，公司劳务
派遣用工人数及比例如下：
截至2016年6月30日，公司员工总数为674人，其中，合同员工人数618
人，劳务派遣人数56人，劳务派遣用工人数占用工总数比例降至8.31%，符合
《劳务派遣暂行规定》等相关法律法规的规定。
发行人控股股东与实际控制人余春明及余超彪承诺：本人将督促公司按照
劳务派遣用工调整方案的要求，将公司劳务派遣用工人数降低至公司用工总量
的10%以下；若公司因未完成劳务派遣员工整改工作或因违反《中华人民共和国
劳动合同法》、《劳务派遣暂行规定》等法律法规关于劳务派遣的规定而遭受
处罚或承担责任的，本人将足额补偿公司损失。
）发行人薪酬制度及员工收入水平情
1、发行人薪酬制度
发行人结合自身生产经营特点制定了适合企业发展的薪酬制度。公司员工
薪酬总体由基本工资（岗位工资）、工龄工资、绩效工资及其他补助构成。不
同员工根据岗位性质、工作年限、工作强度、技能要求适用不同的薪酬结构。
基本工资（岗位工资）是员工薪酬基本组成部分，根据相应的职级和职位
予以核定。目前公司岗位层级从高管到普通员工共设置10个级别。
工龄工资根据员工在公司工作年限确定，公司目前按照每年固定金额累加
计入员工工资总额。
绩效工资根据公司考核情况确定。
其他补助主要包括全勤、加班等奖励或补贴性质的薪酬。
在总体薪酬制度框架下，公司日常经营中，会根据国家政策和物价水平等
宏观因素以及行业及地区竞争状况、公司发展战略和整体效益等情况的变动对
员工薪酬水平和结构进行调整。其中整体薪酬调整和董事高级管理人员的薪酬
调整由公司薪酬与考核委员会制定具体方案，并经董事会讨论通过实施；个别
员工（非董事高管人员）的薪酬调整由人力资源部根据公司薪酬制度办理。
2、发行人员工收入水平
（1）不同级别员工收入水平
报告期内，公司员工按照级别分类的当期年平均工资如下：
"
75,N_A,"予以核定。目前公司岗位层级从高管到普通员工共设置10个级别。
工龄工资根据员工在公司工作年限确定，公司目前按照每年固定金额累加
计入员工工资总额。
绩效工资根据公司考核情况确定。
其他补助主要包括全勤、加班等奖励或补贴性质的薪酬。
在总体薪酬制度框架下，公司日常经营中，会根据国家政策和物价水平等
宏观因素以及行业及地区竞争状况、公司发展战略和整体效益等情况的变动对
员工薪酬水平和结构进行调整。其中整体薪酬调整和董事高级管理人员的薪酬
调整由公司薪酬与考核委员会制定具体方案，并经董事会讨论通过实施；个别
员工（非董事高管人员）的薪酬调整由人力资源部根据公司薪酬制度办理。
2、发行人员工收入水平
（1）不同级别员工收入水平
报告期内，公司员工按照级别分类的当期年平均工资如下：
员工人数变动，年平均工资=月加权平均工资*当期月份数
位员工收入水平：
报告期内，公司员工按照岗位分类的当期月平均工资如下：
注：1、由于各月员工人数变动，年平均工资=月加权平均工资*当期月份数（6或者12）。
3、当地及可比公司工资水平对比
报告期内，当地及可比公司工资水平如下：
上市公司平均工资数据来源于该公司招股意向书。
选取安徽省内同属药用辅料制造业的上市公司山河药辅，及同属宣城地区
近期上市的广信股份作为可比公司。报告期内，发行人厂区较为偏远，员工平
均工资水平偏低，但员工平均工资水平报告期内呈上升趋势，总体高于旌德县
当地平均工资水平；2016年1-6月，公司为新厂区投入生产招聘了部分新员工，
该部分新员工薪酬水平较熟练员工薪酬略低，因此，2016年1-6月发行人员工
整体平均工资水平有所下降。
4、发行人未来薪酬制度及水平变化趋势
报告期内，发行人员工平均工资水平逐渐提高；在可预见的未来，公司将
进一步完善和健全现有薪酬制度，在公平、公正、科学、合理的范畴内，为员
工提供具有竞争力的薪酬待遇，稳定骨干团队，吸引优秀人才，激励员工实现
自我价值，与员工共同分享企业发展的成果。
公司未来员工收入水平趋势将主要受到以下因素影响：1）公司经营情况是
员工薪酬水平的决定因素；2）当地整体薪酬水平的变化，员工收入水平将会有
一定程度提高。未来公司员工的薪酬水平将继续保持当地中等偏上的水平，并
结合经营情况逐步提高员工待遇。
5、发行人劳务派遣工资水平
发行人目前主要生产经营位于旌德县白地镇洪川村，距离城区较远，员工
"
76,N_A,"4、发行人未来薪酬制度及水平变化趋势
报告期内，发行人员工平均工资水平逐渐提高；在可预见的未来，公司将
进一步完善和健全现有薪酬制度，在公平、公正、科学、合理的范畴内，为员
工提供具有竞争力的薪酬待遇，稳定骨干团队，吸引优秀人才，激励员工实现
自我价值，与员工共同分享企业发展的成果。
公司未来员工收入水平趋势将主要受到以下因素影响：1）公司经营情况是
员工薪酬水平的决定因素；2）当地整体薪酬水平的变化，员工收入水平将会有
一定程度提高。未来公司员工的薪酬水平将继续保持当地中等偏上的水平，并
结合经营情况逐步提高员工待遇。
5、发行人劳务派遣工资水平
发行人目前主要生产经营位于旌德县白地镇洪川村，距离城区较远，员工
中聘用农民工较多，部分岗位员工流动性较高；因此，为提高管理效率，公司
对部分临时性和辅助性岗位采用劳务派遣用工形式。
报告期内，发行人劳务派遣用工人数及平均工资情况如下：
报告期内，发行人劳务派遣用工人数及平均工资情况如下：
注：由于各月人数变动，发行人劳务派遣员工年平均工资=月加权平均工资*当期月份数（6或者12）。
发行人主要在部分辅助性、临时性、季节性岗位使用劳务派遣员工。经查
询旌德县平均工资水平，发行人劳务派遣用工工资不低于当地制造业从业人员
年平均工资水平，在同等岗位条件下，发行人为劳务派遣员工提供与正式员工
等同水平的社保福利或补贴，报告期内已经按照《劳务派遣协议》约定履行了
社保费用支付义务。报告期内发行人劳务派遣员工的薪酬水平公允。
6、发行人员工人数变动与业务规模的匹配情况
报告期内，发行人员工人数与产量关系如下：
告期内，发行人员工人数与产量关系如下：
报告期内，公司生产能力未发生重大变动，2015年及2016年1-6月，公司
新招聘部分员工为新厂区做培训储备，当年单位员工产量略有下降；公司整体
员工人数变动情况与业务规模和经营情况相匹配。
报告期内，公司生产能力未发生重大变动，2015年及2016年1-6月，公司
新招聘部分员工为新厂区做培训储备，当年单位员工产量略有下降；公司整体
员工人数变动情况与业务规模和经营情况相匹配。
十二、持有 5%以上股份的主要股东以及作为股东的董
事、监事、高级管理人员作出的重要承诺及其履行情况
持有公司5%以上股份的股东为控股股东、实际控制人之一余春明先生。
（一）关于避免同业竞争的承诺
为避免同业竞争，维护公司和中小股东的利益，持有公司 5%以上股份的主
"
77,N_A,"告期内，发行人员工人数与产量关系如下：
报告期内，公司生产能力未发生重大变动，2015年及2016年1-6月，公司
新招聘部分员工为新厂区做培训储备，当年单位员工产量略有下降；公司整体
员工人数变动情况与业务规模和经营情况相匹配。
报告期内，公司生产能力未发生重大变动，2015年及2016年1-6月，公司
新招聘部分员工为新厂区做培训储备，当年单位员工产量略有下降；公司整体
员工人数变动情况与业务规模和经营情况相匹配。
十二、持有 5%以上股份的主要股东以及作为股东的董
事、监事、高级管理人员作出的重要承诺及其履行情况
持有公司5%以上股份的股东为控股股东、实际控制人之一余春明先生。
（一）关于避免同业竞争的承诺
为避免同业竞争，维护公司和中小股东的利益，持有公司 5%以上股份的主
要股东、公司实际控制人出具了《避免同业竞争的承诺函》，具体内容详见本招
股意向书“第七节 同业竞争与关联交易”之“一、（二）避免同业竞争的承诺”
相关内容。
（二）关于股份锁定的承诺
持有公司 5%以上股份的主要股东以及作为股东的董事、监事、高级管理人
员已就本次发行前其所持公司股份进行锁定的事项作出承诺，具体内容详见本
招股意向书“重大事项提示”之“三、公司股东关于股份锁定的承诺”等相关
内容。
一、主营业务及其变化情况
公司主营业务为药用空心胶囊的生产与销售，主要产品包括明胶空心胶囊
与肠溶明胶空心胶囊。自设立以来，公司主营业务未发生重大变化。
二、所处行业基本情况
公司所处行业为药用辅料制造业，业务范围包括明胶空心胶囊和肠溶明胶
空心胶囊的生产、销售，根据证监会《上市公司行业分类指引》（证监会公告
[2012]31号），归类为“C27 医药制造业”。
（一）行业管理体制
1、行业主管部门注
国家食品药品监督管理总局注作为行业主管部门，负责全国药品的监督管理
工作。省（直辖市、自治区）食品药品监督管理局主管本行政区域内的药品监
督管理工作，省以下包括地（州、盟）、市根据工作需要，设置食品药品监督管
理机构。国家发改委为本行业产业政策指导部门，负责对产业发展提供导向性
意见、项目审批等。
中国医药包装协会药用空心胶囊专业委员会是本行业的自律组织，致力于
促进国内外技术交流、产品更新，制定、执行行业相关规范标准。
2、行业监管体制
《中华人民共和国药品管理法》规定，药品生产企业生产药品所需的辅料，
"
78,N_A,"空心胶囊的生产、销售，根据证监会《上市公司行业分类指引》（证监会公告
[2012]31号），归类为“C27 医药制造业”。
（一）行业管理体制
1、行业主管部门注
国家食品药品监督管理总局注作为行业主管部门，负责全国药品的监督管理
工作。省（直辖市、自治区）食品药品监督管理局主管本行政区域内的药品监
督管理工作，省以下包括地（州、盟）、市根据工作需要，设置食品药品监督管
理机构。国家发改委为本行业产业政策指导部门，负责对产业发展提供导向性
意见、项目审批等。
中国医药包装协会药用空心胶囊专业委员会是本行业的自律组织，致力于
促进国内外技术交流、产品更新，制定、执行行业相关规范标准。
2、行业监管体制
《中华人民共和国药品管理法》规定，药品生产企业生产药品所需的辅料，
必须符合药用要求；同时，《中国药典》（2010年版·二部）、《中国药典》（2015
注 国 家 食 品 药 品 监 督 管 理 总 局 成 立 于 2 013年3月22日。根据2013年3月10日披露的国务院机构改革和
职能转变方案，将食品安全办的职责、食品药品监管局的职责、质检总局的生产环节食品安全监督管理职
责、工商总局的流通环节食品安全监督管理职责整合，组建国家食品药品监督管理总局。主要职责是，对
生产、流通、消费环节的食品安全和药品的安全性、有效性实施统一监督管理等。在此之前，由国家食品
药品监督管理局负责全国药品的监督管理工作。同时，根据国务院以国发〔2013〕18号印发《关于地方改
革完善食品药品监督管理体制的指导意见》，各省、市、县级政府原则上参照国务院整合食品药品监督管
理职能和机构的模式，将原食品安全办、原食品药品监管部门、工商行政管理部门、质量技术监督部门的
食品安全监管和药品管理职能进行整合，组建食品药品监督管理机构，对食品药品实行集中统一监管，同
时承担本级政府食品安全委员会的具体工作。
年版·四部）均明确将明胶空心胶囊和肠溶明胶空心胶囊归类为药用辅料，分
别用于胶囊剂和迟缓胶囊剂的制备。因此，国家食药监局一直对药用空心胶囊
企业参照药品生产企业实施许可管理，即企业应取得《药品生产许可证》，品种
必须获得注册许可。
（1）药品生产许可证制度
国家食药监局规定，药用空心胶囊生产企业按照药品生产企业实行许可管
理，凡开办药用空心胶囊生产企业，应由所在地省级食品药品监督管理局审批，
核发《药品生产许可证》。凭《药品生产许可证》至工商行政部门办理注册登记。
"
79,N_A,"理职能和机构的模式，将原食品安全办、原食品药品监管部门、工商行政管理部门、质量技术监督部门的
食品安全监管和药品管理职能进行整合，组建食品药品监督管理机构，对食品药品实行集中统一监管，同
时承担本级政府食品安全委员会的具体工作。
年版·四部）均明确将明胶空心胶囊和肠溶明胶空心胶囊归类为药用辅料，分
别用于胶囊剂和迟缓胶囊剂的制备。因此，国家食药监局一直对药用空心胶囊
企业参照药品生产企业实施许可管理，即企业应取得《药品生产许可证》，品种
必须获得注册许可。
（1）药品生产许可证制度
国家食药监局规定，药用空心胶囊生产企业按照药品生产企业实行许可管
理，凡开办药用空心胶囊生产企业，应由所在地省级食品药品监督管理局审批，
核发《药品生产许可证》。凭《药品生产许可证》至工商行政部门办理注册登记。
同时，《中华人民共和国药品管理法》规定，药品生产企业生产药品所需的
辅料，必须符合药用要求。药品生产企业必须从具有药品生产许可证的企业采
购药用空心胶囊，经检验合格后方可入库和使用。
（2）药用辅料批准文号制度
《国务院对确需保留的行政审批项目设定行政许可的决定》（国务院令第
412 号）明确保留了“药用辅料注册”，并设定为行政许可项目。国家食药监局
一直对药用辅料实施批准文号管理，对于已有国家标准的药用空心胶囊，按照
《药用辅料注册申报材料要求》（食药监注函[2005]61 号）“四、已有国家标准
的药用空心胶囊、胶囊用明胶和药用明胶注册申报材料要求”的规定申报资料，
由省食品药品监督管理局负责审批。
(3)药用辅料关联审评审批制度
2016年8月10日，国家食药监局发布《总局关于药包材药用辅料与药品关
联审评审批有关事项的公告》（2016 年第 134 号），明确要求将直接接触药品的
包装材料和容器（以下简称药包材）、药用辅料由单独审批改为在审批药品注册
申请时一并审评审批。实施关联审评审批制度的药用辅料包括：（1）境内外上
市制剂中未使用过的药用辅料；（2）境外上市制剂中已使用而在境内上市制剂
中未使用过的药用辅料；（3）境内上市制剂中已使用，未获得批准证明文件或
核准编号的药用辅料；（4）已获得批准证明文件或核准编号的药用辅料改变给
药途径或提高使用限量；（5）国家食品药品监督管理总局规定的其他药用辅料。
对于目前已取得批准文号的药用辅料，其批准证明文件在效期内继续有效。
"
