页码,表格,纯文本
243,N_A,"靖江万鑫商贸有限公司情况详见本招股意向书“第七节 同业竞争与关联交
易”之“三、关联方和关联交易”。除此之外，报告期内本公司董事、监事、高
级管理人员和核心技术人员、公司关联方及持有本公司 5%以上股份的股东在上
述主要供应商中未持有任何权益。
4、公司针对原材料采购价格波动情况采取的风险控制措施及实际执行情况
公司自成立以来一直将采购管理和成本控制定位为企业重要的竞争手段之
一并实施了一系列成本管理行动和措施。
报告期内公司一般选取多家同种类原材料供应商，确定最优采购价格。公司
利用供应商之间的竞争报价能够最大程度的压缩采购成本。
另一方面公司致力于持续改善产品生产工艺，提高生产效率及产品合格率从
而降低物耗水平。报告期内，公司采用精益生产方式，对一线员工进行了多技能
岗位培训，并长期推行生产现场 6S 管理；同时，在生产方式上实行单元式连续
流生产，辅以快速换模、自动在线检测等技术手段，降低了现场在制品存量，加
快了生产周期。
报告期内公司资产运营效率得到提升，工艺革新和精益生产产生了预计的效
果。通过效率提升，公司对价格波动风险的抵御能力得到了增强。
5、主要能源使用情况
公司生产所需能源主要为电力，用于机器设备运转、照明方面。公司及各地
分子公司生产厂区均位于较为成熟的工业区或开发区，电力及其他能源供应有充
分保障。报告期内，公司用电量及电价变动情况如下：
报告期内，公司电力成本占公司营业成本的比例较低，且在报告期内较为稳
定，对公司利润水平的影响较小。
6、公司外协情况
（1）外协加工环节具体内容、工序及其在发行人开发、生产工序中所处环
节和地位
报告期内，公司的外协加工具体内容为部分非总成标准件的部分生产环节，
包括金属板材冲压加工、焊接、电泳及镀锌、磷化等表面处理、注塑，具体工序
如下：
金属板材冲压：外协单位自公司处领料后，使用公司提供的模具，将原料进
行冲压，使金属板料在冲模中承受压力而被切离或成形。
焊接：外协单位将冲压好的车身板件利用焊机进行局部加热或同时加热、加
压而接合在一起形成非总成件。
在自身产能有限的背景下，公司集中资源于核心工序和制造环节，通过将简
单成熟的冲压、焊接加工工序委托外协单位完成，以提升为主机厂商的综合服务
能力。
电泳及镀锌、磷化：由具备表面处理能力的外协单位进行，主要作用是零件
防腐蚀，工序主要分为除油→热水洗→除锈→冷水洗→磷化→电泳或镀锌→热水
"
244,N_A,"报告期内，公司的外协加工具体内容为部分非总成标准件的部分生产环节，
包括金属板材冲压加工、焊接、电泳及镀锌、磷化等表面处理、注塑，具体工序
如下：
金属板材冲压：外协单位自公司处领料后，使用公司提供的模具，将原料进
行冲压，使金属板料在冲模中承受压力而被切离或成形。
焊接：外协单位将冲压好的车身板件利用焊机进行局部加热或同时加热、加
压而接合在一起形成非总成件。
在自身产能有限的背景下，公司集中资源于核心工序和制造环节，通过将简
单成熟的冲压、焊接加工工序委托外协单位完成，以提升为主机厂商的综合服务
能力。
电泳及镀锌、磷化：由具备表面处理能力的外协单位进行，主要作用是零件
防腐蚀，工序主要分为除油→热水洗→除锈→冷水洗→磷化→电泳或镀锌→热水
洗→钝化→烘干等。
注塑：外协单位负责为公司生产的部分管类件安装塑料部件。
电泳及镀锌、注塑工艺与公司的冲压、焊接、总成等主要工序技术上有所区
别，并非核心工艺，公司建有独立电泳车间，但规模较小，另建镀锌、注塑生产
线的固定成本又相对较高，不具有规模优势，因此委托外协单位进行处理更为经
济，并且外部技术相对成熟，不存在技术依赖性。
公司产品开发、生产工序主要包括三部分，一是产品开发；二是非总成标准
件的生产；三是总成部件的集成。其中产品开发、总成部件的集成为核心工序，
均由公司自主独立完成。非总成标准件的生产为非核心工序，部分交由外协单位
完成。公司产品开发、生产各节点工序情况如下：
①产品开发
独立的产品开发能力是公司核心竞争力之一，是产品开发、生产工序中的核
心工序。公司将产品整体方案设计技术、模具设计制造技术等运用于产品开发的
具体实施过程。
Ⅰ、公司接收主机厂产品开发数据后，组织产品工程师、模具设计师、软件
工程师等技术人员进行技术工艺论证，针对客户开发要求进行产品整体方案的设
计。整体方案设计工作不仅关系到公司产品质量，而且还涉及到与客户整车工艺
结合，最终影响整车品质。公司产品整体方案设计能够最有效地满足客户在整车
装配环节对精确度的要求，是公司在自动化冲压模具的设计与研究、螺母板成形
模具与工艺优化、冲压过程 CAD仿真技术及优化技术研究、高强度冲压件应用开
发及冷冲压模具成型工艺研发、多工位级进模具研发等核心技术全面运用的过
程。
Ⅱ、模具设计制造：公司根据产品结构进行模具设计，运用 CAD 仿真技术并
借鉴公司自有数据库进行模具全三维实体设计、模具设计防干涉检查等。设计完
"
245,N_A,"具体实施过程。
Ⅰ、公司接收主机厂产品开发数据后，组织产品工程师、模具设计师、软件
工程师等技术人员进行技术工艺论证，针对客户开发要求进行产品整体方案的设
计。整体方案设计工作不仅关系到公司产品质量，而且还涉及到与客户整车工艺
结合，最终影响整车品质。公司产品整体方案设计能够最有效地满足客户在整车
装配环节对精确度的要求，是公司在自动化冲压模具的设计与研究、螺母板成形
模具与工艺优化、冲压过程 CAD仿真技术及优化技术研究、高强度冲压件应用开
发及冷冲压模具成型工艺研发、多工位级进模具研发等核心技术全面运用的过
程。
Ⅱ、模具设计制造：公司根据产品结构进行模具设计，运用 CAD 仿真技术并
借鉴公司自有数据库进行模具全三维实体设计、模具设计防干涉检查等。设计完
成后进行模具泡沫实型制造、毛坯铸件订制，之后在毛坯铸铁件上进行数控加工、
装配、调试并形成样品。
②非总成标准件生产
报告期内，由于下游整车车型更新迭代加快，发行人生产产品型号已由 2013
年的 1,800 余种上升到 2016 年上半年的 3,000 种左右，呈爆发增长态势，虽然
发行人报告期内购置了多台具有高质量的工艺技术水平和大规模的生产能力的
冲压、焊接生产设备，但产能利用率仍超过 100%。为更好地满足客户对产品多
批次、灵活批量的弹性需求，将一部分非总成标准件的简单冲压、焊接等环节通
过外协加工方式进行，将自身业务重心集中于产品开发和总成部件生产，充分发
挥专业化协作分工机制，提高资金使用效率，满足公司的生产需要。
非总成标准件外协加工环节中，外协厂商向发行人领取加工过程所需的原材
料、模具、检具、夹具，根据发行人提供的生产作业指导书、工艺卡片、加工图
纸、技术指标、质量标准等进行产品生产和质量控制。整个生产环节中，由发行
人负责采购原材料并提供模具、技术支持、制定质量控制标准及执行验收标准，
外协加工厂仅提供机械设备和生产人员服务。
非总成标准件加工完成后，由发行人继续进行总成部件的集成。
③总成部件集成
总成件（Assembly）是由若干零件（Part and Component）或若干分总成件
（Sub assembly）经过装配组合工序，能够达到整车总装环节层次的一定装配级
别或实现某一功能形式的组合体，例如发动机总成、变速器总成、冲压及焊接件
总成等。掌握冲压及焊接总成件集成能力是公司核心竞争力之一，是产品开发、
"
246,N_A,"料、模具、检具、夹具，根据发行人提供的生产作业指导书、工艺卡片、加工图
纸、技术指标、质量标准等进行产品生产和质量控制。整个生产环节中，由发行
人负责采购原材料并提供模具、技术支持、制定质量控制标准及执行验收标准，
外协加工厂仅提供机械设备和生产人员服务。
非总成标准件加工完成后，由发行人继续进行总成部件的集成。
③总成部件集成
总成件（Assembly）是由若干零件（Part and Component）或若干分总成件
（Sub assembly）经过装配组合工序，能够达到整车总装环节层次的一定装配级
别或实现某一功能形式的组合体，例如发动机总成、变速器总成、冲压及焊接件
总成等。掌握冲压及焊接总成件集成能力是公司核心竞争力之一，是产品开发、
生产工序中的核心工序。
以公司产品前纵梁总成为例：前纵梁总成是乘用车车身结构件，车身设计中
通过前纵梁总成的形状、结构和材料等的变化，来达到吸收能量、提高车辆抗正
面撞击的要求，是极为重要的安全件。前纵梁总成是左右对称件，全长一般为
2.3米左右，整体结构为冲压焊接结构，材质一般为热镀锌低碳低合金钢，厚度
在 1.6～2.3 毫米，由前纵梁内板、前纵梁外板、前纵梁右支架、前纵梁后板、
前纵梁后部盖板、轮罩右前及后加强件等多个冲压零件或分总成集成而成。在集
成过程中需在接近 200个焊点上进行焊接方可成形。
该总成件集成时需要掌握镀锌板材本身性能、工件表面处理、焊接设备选择、
焊接工艺和零件夹紧定位技术、机器人自动化焊接和手工焊接兼用技术。
下图为前纵梁总成中左右对称件之右前纵梁总成图示：
与总成部件的集成相比，发行人外协环节的非总成标准件生产工艺并不复
杂，多为经过一次冲压或简单焊接工序即可成型的零部件，这些零部件在经过集
成前尚不能形成单独功能，达不到整车总装层次。非总成标准件工序与产品开发、
总成部件的集成相比，属于发行人的非核心工序。
（2）外协厂商的选择及外协加工费定价情况
公司的外协厂商多达数十家，且分布较分散，集中度不高，外协加工涉及的
品种众多，加工难易度、工作量差异较大；外协加工缺乏统一公开的市场报价，
因加工品种、加工内容、工艺等差异，针对不同加工内容的厂商报价也缺乏可比
性。
针对以上情况，公司主要通过制定并执行完善的管理制度来选择外协厂商并
确定加工费价格，从而通过市场化竞争制度实现外协厂商选择及其加工费用确定
"
247,N_A,"与总成部件的集成相比，发行人外协环节的非总成标准件生产工艺并不复
杂，多为经过一次冲压或简单焊接工序即可成型的零部件，这些零部件在经过集
成前尚不能形成单独功能，达不到整车总装层次。非总成标准件工序与产品开发、
总成部件的集成相比，属于发行人的非核心工序。
（2）外协厂商的选择及外协加工费定价情况
公司的外协厂商多达数十家，且分布较分散，集中度不高，外协加工涉及的
品种众多，加工难易度、工作量差异较大；外协加工缺乏统一公开的市场报价，
因加工品种、加工内容、工艺等差异，针对不同加工内容的厂商报价也缺乏可比
性。
针对以上情况，公司主要通过制定并执行完善的管理制度来选择外协厂商并
确定加工费价格，从而通过市场化竞争制度实现外协厂商选择及其加工费用确定
的公允性。公司主要从外协厂商的设备状况、交货周期、报价水平、管理能力、
产品质量等因素设定若干标准综合确定外协厂商及其加工费水平，具体情况如
下：
①公司对于计划采取外协方式生产的产品，由综合计划科、采购部将产品图
纸、标准、样件、工艺路线等技术文件分送财务部和意向外协厂商。其中，意向
外协供应商一般不低于 3家。
②意向外协厂商根据自身的生产条件进行测算并向公司提交报价表。
③综合计划科、采购部、财务部根据各家意向外协厂商的报价结合公司的基
础数据进行招标，同等条件下优先选择确定有相似产品生产经验、信用程度较高、
设备状况良好的意向外协厂商。
④采购部正式提交招标结果报总经理审批后签署外协生产合同、质量协议
等，对外协件名称、加工类型、规格、单价以及价格有效期等进行了明确规定，
外协厂商需严格执行。若市场情况发生重大变化，公司与外协厂商重新签署协议
书按照公平原则对价格进行确认。
由于发行人外协加工的产品、工序未涉及发行人核心技术，在市场上可以选
择的外协商范围较广。发行人在选择外协商时，对该产品或部件的外协加工价格
进行大致的估算，并在考虑加工质量、交货时效、过往合作经验、产品或部件涉
及的加工工艺等因素基础上，选择不低于 3 家的外协商进行询价，外协商在充分
考虑其自身合理工时、房租折旧水电等制造、管理、销售费用及合理利润在内后，
向发行人进行报价。
发行人最终审核后确定的外协商报价与发行人测算价格不存在重大差异。
此外，报告期内发行人关联方春绿机械、远达机械曾为发行人提供外协加工
服务，春绿机械、远达机械均需严格执行公司的相关程序进行竞标比价，春绿机
"
248,N_A,"外协厂商需严格执行。若市场情况发生重大变化，公司与外协厂商重新签署协议
书按照公平原则对价格进行确认。
由于发行人外协加工的产品、工序未涉及发行人核心技术，在市场上可以选
择的外协商范围较广。发行人在选择外协商时，对该产品或部件的外协加工价格
进行大致的估算，并在考虑加工质量、交货时效、过往合作经验、产品或部件涉
及的加工工艺等因素基础上，选择不低于 3 家的外协商进行询价，外协商在充分
考虑其自身合理工时、房租折旧水电等制造、管理、销售费用及合理利润在内后，
向发行人进行报价。
发行人最终审核后确定的外协商报价与发行人测算价格不存在重大差异。
此外，报告期内发行人关联方春绿机械、远达机械曾为发行人提供外协加工
服务，春绿机械、远达机械均需严格执行公司的相关程序进行竞标比价，春绿机
械、远达机械加工费价格同非关联方的加工费价格基本趋近。具体参见本招股意
向书“第七节 同业竞争与关联交易”之“三、关联方和关联交易”之“（二）
关联交易情况”之“1、经常性关联交易”。
综上，报告期内外协加工费系发行人与外协单位经充分考虑自身充分必要的
商业条件后，通过市场化投标竞争来确定外协厂商及其加工费水平，从而确保了
外协加工费定价的公允性和市场化。”
（3）外协产品的质量控制情况
公司对外协产品的质量控制措施包括事前控制及事后控制两方面：
①事前控制：
意向外协厂商在经过公司对其生产条件、质量控制、物流等方面的全面评定
后才能成为公司的合格外协厂商；生产前的产品开发、模具开发及样品制作工作
由公司完成，外协厂商仅根据公司产品技术质量文件要求组织生产；为保证生产
质量，公司会根据客户需求及自己的生产经验编写质量控制文件，提供给外协厂
商，作为质量控制的依据并对其进行培训；对新加入的外协厂商，公司为谨慎起
见，还会安排技术人员现场指导企业的生产质量控制。
②事后控制：
外协产品入厂时，公司质检人员对其按照公司质量标准进行严格入厂检验；
销售给客户后，公司售后服务人员将进行持续质量跟踪。从质量控制效果看，公
司外协产品的质量较好，客户满意度较高。公司自采用外协生产方式以来，未出
现重大质量事故和重大质量纠纷。
（4）外协生产费用对发行人营业成本的影响
2013年至2016年上半年，外协生产费用占当期营业成本比例分别为12.25%、
10.55%、10.55%和 9.23%。报告期内，发行人各外协加工工序发生金额及占营业
"
249,N_A,"质量，公司会根据客户需求及自己的生产经验编写质量控制文件，提供给外协厂
商，作为质量控制的依据并对其进行培训；对新加入的外协厂商，公司为谨慎起
见，还会安排技术人员现场指导企业的生产质量控制。
②事后控制：
外协产品入厂时，公司质检人员对其按照公司质量标准进行严格入厂检验；
销售给客户后，公司售后服务人员将进行持续质量跟踪。从质量控制效果看，公
司外协产品的质量较好，客户满意度较高。公司自采用外协生产方式以来，未出
现重大质量事故和重大质量纠纷。
（4）外协生产费用对发行人营业成本的影响
2013年至2016年上半年，外协生产费用占当期营业成本比例分别为12.25%、
10.55%、10.55%和 9.23%。报告期内，发行人各外协加工工序发生金额及占营业
成本的比例如下表所示：

（5）主要外协厂商情况
报告期内，前五名外协厂商向公司提供加工服务的金额、及占公司当期加工
费总额的比例情况如下：
江苏春绿机械制造有限公司情况详见本招股意向书“第七节 同业竞争与关
联交易”之“三、关联方和关联交易”。除此之外，报告期内本公司董事、监事、
高级管理人员和核心技术人员、公司关联方及持有本公司 5%以上股份的股东在
上述主要外协厂商中未持有任何权益。
发行人前五大外协厂商中，靖江市永固轿配涂装厂（简称“永固涂装”）主
要从事电镀、电泳等金属表面处理业务。
永固涂装为个人独资企业，投资人为王灿明。王灿明本人及其关系密切家庭
成员与发行人、发行人实际控制人及控股股东、发行人其他股东及董事、监事、
高级管理人员不存在关联关系，不存在关联交易非关联化的情形，不存在其他利
益安排。
2013 年至2016 上半年，永固涂装为发行人提供电镀、电泳等汽车零部件表
面处理外协加工，占发行人同类业务的比重分别为 65.99%、76.85%、35.02%和
46.90%。2015 年之后占比有所下降，主要系因发行人零部件产品中需要通过永
固涂装进行电镀镀锌处理的汽车零部件（向东风日产乘用车供应车型老款骐达、
老款天籁）用量有所减少所致。
经保荐机构、会计师和律师访谈，来自发行人业务占永固涂装业务占比约为
30%左右。
永固涂装经营的电镀行业属于重污染行业，根据国家相关规定，应履行相关
环保、职业病危害等工作。
经保荐机构、会计师和律师现场走访永固涂装、访谈永固涂装总经理，了解
到永固涂装位于江苏省靖江市经济开发区城北园区山南路1号，成立于 2002年，
"
250,N_A,"2013 年至2016 上半年，永固涂装为发行人提供电镀、电泳等汽车零部件表
面处理外协加工，占发行人同类业务的比重分别为 65.99%、76.85%、35.02%和
46.90%。2015 年之后占比有所下降，主要系因发行人零部件产品中需要通过永
固涂装进行电镀镀锌处理的汽车零部件（向东风日产乘用车供应车型老款骐达、
老款天籁）用量有所减少所致。
经保荐机构、会计师和律师访谈，来自发行人业务占永固涂装业务占比约为
30%左右。
永固涂装经营的电镀行业属于重污染行业，根据国家相关规定，应履行相关
环保、职业病危害等工作。
经保荐机构、会计师和律师现场走访永固涂装、访谈永固涂装总经理，了解
到永固涂装位于江苏省靖江市经济开发区城北园区山南路1号，成立于 2002年，
通过 ISO9001 质量体系认证。其经营者王灿明原从事医药行业，在环保方面意
识较强。保荐机构、会计师和律师现场核查了永固涂装工业废水和废气的监测报
告、排放污染物许可证、竣工环保验收批复、污泥和危废处置合同、劳保用品发
放明细和签收表、江苏省职业健康检查机构出具的职业健康检查总结报告书、职
工花名册和社会保险电子缴费凭证，并核查全国企业信用信息公示系统以及环
保、职业病危害以及社保当地主管部门网站信息。
经保荐机构、会计师和律师核查，永固涂装主要从事电镀、电泳和金属表面
处理，是发行人零部件表面处理（电镀、电泳等）环节最大的供应商，同类外协
业务占比 50%左右。永固涂装具备必要的环保资质，工业废水和废气监测指标均
正常；按照上述职业病防护法律法规和行业规范规定落实劳保用品发放、职业病
体检等要求；按照当地标准缴纳社会保险费，截至目前在生产经营资质、环保、
职业病危害以及社保缴纳方面均未受到主管部门的处罚。
同时，经保荐机构、会计师和律师对永固涂装总经理访谈，其认为永固涂装
未来2-3年内面临一定的成本上升压力，预计总体经营成本上升 10%-15%左右。
按目前永固涂装占发行人同类业务份额测算，在其他条件不变的前提下，约影响
发行人净利润0.3%左右。
公司的主要外协厂商（含上述报告期内的前 5大外协厂商）如下，这些外协
厂商（共计24家）合计占公司外协费用支出的 70%以上:
报告期内，发行人外协厂商中江苏春绿机械制造有限公司为发行人实际控制
人、控股股东陈竞宏之二女儿陈卫、二女婿顾明彪共同持股 100%的公司；靖江
"
