页码,表格,纯文本
124,N_A,"政府办公厅关于确认江苏华德汽配制造有限公司历史沿革及改制等有关事项合
规性的函》，对江苏华德历史沿革、股权变更和产权界定等事项发表意见如下：
“江苏华德汽配制造有限公司前身为成立于 1980 年的乡办集体企业靖江县柏木
公社家具厂，1994 年改制为股份合作制试点企业靖江华德汽车配件厂。2000年，
靖江华德汽车配件厂将企业性质由股份合作制变更为集体所有制。江苏华德汽配
制造有限公司历史沿革、股权变更和产权界定等事项履行了相关程序，并经主管
部门批准，符合国家法律法规和政策规定。”
基于上述，保荐机构和发行人律师认为，第一次股权清理（即内部职工股
清退）按照原始出资额进行清退，主要是考虑到当时华德汽配发展预期并不明确
且规模较小、股份合作制企业和集体企业股权并无可公开交易的市场参考价格以
及职工个人股股东持股期间亦取得相应股息等因素，以及根据华德汽配《股份合
作制章程》的规定，股份合作制的股权只有在职工确因不可抗拒的特殊情况下，
经申请才能在公司内部股东之间转让或者由公司回购，转让范围受到一定的限
制，转让价格受买方的资金实力、卖方的资金需求紧迫性等一系列客观因素的限
制，该等退股行为是建立在自主、自愿基础上的，基于以上一些客观因素，退股
定价具有一定的公允性；退股系其自愿行为，不存在违背股权拥有人意愿的强制
退股问题；上述退股相关决策程序完备，履行了相关法定程序，合法合规，不存
在损害职工个人股股东权益的情形。
（4）本项核查中，对部分无法取得联系股东的权益采取的保护措施
①原始文件核查、媒体公告及交叉印证访谈
自股份合作制企业华德汽配1994年设立至1999年改制为集体企业期间， 45
名职工个人股股东（占华德汽配初始登记在册的职工个人股股东人数的 34.62%，
所持股份占原职工个人股股份总额的 16.69%，企业总股本的 3.43%）因离职、
个人经济需要等原因结算退出职工个人股，保荐机构和发行人律师已核查其退出
结算个人股时已签署之退股申请、股金处理协议、职工本人签收退股股金记录等
原始文件，确认了关于其职工个人股认购、退出的情况。此外，上述股权清理行
为的年代久远、时间跨度长、转让分散，并非集中统一的清理行为，相关制度和
程序比较完善，历史上未发生相关纠纷，且受让方不涉及公司现有股东或董事、
监事、高级管理人员；因此，发行人未进行媒体公告、保荐机构和发行人律师未
"
125,N_A,"自股份合作制企业华德汽配1994年设立至1999年改制为集体企业期间， 45
名职工个人股股东（占华德汽配初始登记在册的职工个人股股东人数的 34.62%，
所持股份占原职工个人股股份总额的 16.69%，企业总股本的 3.43%）因离职、
个人经济需要等原因结算退出职工个人股，保荐机构和发行人律师已核查其退出
结算个人股时已签署之退股申请、股金处理协议、职工本人签收退股股金记录等
原始文件，确认了关于其职工个人股认购、退出的情况。此外，上述股权清理行
为的年代久远、时间跨度长、转让分散，并非集中统一的清理行为，相关制度和
程序比较完善，历史上未发生相关纠纷，且受让方不涉及公司现有股东或董事、
监事、高级管理人员；因此，发行人未进行媒体公告、保荐机构和发行人律师未
进行访谈。
1999 年华德汽配由股份合作制企业改制成为集体所有制企业时退股的 4 名
原始股东（所持股份占原职工个人股股份总额的 0.68%）因时间较久失去联系方
式或其个人原因尚未完成确权。因此，发行人已在相关媒体（全国性的农民日报
和地方性的江苏经济报）上刊登公告，告知上述未能完成确权的 4名原始股东与
公司取得联系并确认其相关信息。此外，对该等未能完成确权的人员，保荐机构
和发行人律师核对了内部职工个人股股东名册等书面文件，并与公司相关人员就
4名原始股东出资、退出事宜进行了交叉印证访谈，确认该等 4名职工个人股股
东已取得相应的股金、股息等款项，对退股事宜不存在任何异议、纠纷或潜在纠
纷。
②实际控制人的承诺
发行人实际控制人陈竞宏于 2014年12 月及2016年2月分别出具《承诺函》
承诺：截至《承诺函》出具日，江苏华德内部职工个人股清退不存在权属纠纷或
潜在风险。今后如因内部职工个人股清退导致任何权属纠纷或潜在风险，本人自
愿承担相应民事赔偿责任，如因上述事项导致发行人承担相关赔偿责任的，本人
将全额补偿发行人因此受到的全部经济损失。
③设立专门应急小组
发行人设立了以总经理葛江宏、董事会秘书和财务总监许霞为主的专门应急
小组，以应对和处理上述未能取得联系职工个人股股东可能发生的问题，如当该
等职工个人股股东主动与发行人联系时，作出对历史问题的解释、查询及核对原
始文件。若涉及发行人实际控制人赔偿责任的，及时告知实际控制人按照相关法
定程序和公开承诺进行处理。
基于上述，保荐机构和发行人律师认为，除股份合作制企业华德汽配 1994
"
126,N_A,"承诺：截至《承诺函》出具日，江苏华德内部职工个人股清退不存在权属纠纷或
潜在风险。今后如因内部职工个人股清退导致任何权属纠纷或潜在风险，本人自
愿承担相应民事赔偿责任，如因上述事项导致发行人承担相关赔偿责任的，本人
将全额补偿发行人因此受到的全部经济损失。
③设立专门应急小组
发行人设立了以总经理葛江宏、董事会秘书和财务总监许霞为主的专门应急
小组，以应对和处理上述未能取得联系职工个人股股东可能发生的问题，如当该
等职工个人股股东主动与发行人联系时，作出对历史问题的解释、查询及核对原
始文件。若涉及发行人实际控制人赔偿责任的，及时告知实际控制人按照相关法
定程序和公开承诺进行处理。
基于上述，保荐机构和发行人律师认为，除股份合作制企业华德汽配 1994
年设立至 1999 年改制为集体企业期间退股的 45 名职工个人股股东外，对于无
法取得联系的职工个人股股东，发行人已采取了媒体公告、发行人实际控制人承
诺以及设立专门应急小组的保护措施，同时又采取核查原始文件、交叉印证访谈
的方式作为确认该等职工个人股股东出资和退股事实的补充手段，上述保护措施
和补充手段合法合规，充分保护了该等职工个人股股东的权益；同时考虑到该等
无法取得联系的职工个人股股东所持股权占当时企业总股本比例较低、该次股权
清理年代久远，以及发行人辅导备案公告、招股意向书申报稿和预披露稿等有关
发行人本次发行上市信息在公开途径上均已充分体现，而截至招股意向书签署
日，不存在上述无法取得联系的职工个人股股东向发行人及其实际控制人、控股
股东、现任董事、监事和高级管理人员提出异议、主张任何权利以及提起诉讼或
仲裁的情形，因此，目前无法取得联系的职工个人股股东不存在纠纷或潜在纠纷。
2、保荐机构和发行人律师对江苏华德职工委托持股解除情况（第二次股权
清理）进行的核查
背景情况：
江苏华德在改制为有限公司时，当时的职工实际参与了出资，由于人数众
多，为便于管理，2000年1月12日，华德汽配召开全体股东大会，选举了黄松
泉、陈宏彬、殷玉章、陶振辉、陈旗、陈志龙、袁玉初、陈先宏、黄灿平、顾
礼萍、刘萍11名股东代表，合计代 112名职工持有 1,653,020元出资。
为进一步规范股权结构、减少实际股东人数，适应企业发展需要，2003 年
6月18日，江苏华德通过股东会决议，全体股东一致同意黄松泉等 13名股东将
"
127,N_A,"仲裁的情形，因此，目前无法取得联系的职工个人股股东不存在纠纷或潜在纠纷。
2、保荐机构和发行人律师对江苏华德职工委托持股解除情况（第二次股权
清理）进行的核查
背景情况：
江苏华德在改制为有限公司时，当时的职工实际参与了出资，由于人数众
多，为便于管理，2000年1月12日，华德汽配召开全体股东大会，选举了黄松
泉、陈宏彬、殷玉章、陶振辉、陈旗、陈志龙、袁玉初、陈先宏、黄灿平、顾
礼萍、刘萍11名股东代表，合计代 112名职工持有 1,653,020元出资。
为进一步规范股权结构、减少实际股东人数，适应企业发展需要，2003 年
6月18日，江苏华德通过股东会决议，全体股东一致同意黄松泉等 13名股东将
其持有的江苏华德出资（其中包括黄松泉、陈宏彬、殷玉章、陶振辉、陈旗、
陈志龙、袁玉初、陈先宏、黄灿平、顾礼萍、刘萍 11名股东代为持有的合计 112
名股东的全部出资）转让给江苏华德其余 5 名股东陈竞宏、朱世民、刘春祥、
刘丹群、孙福余，江苏华德股东总人数由 130 人减少至5人，具体如下：
（1）定价依据
考虑到当时国内宏观经济形势存在一定的不确定性、江苏华德发展预期并不
明确且规模较小，以及根据截至 2002 年 12 月 31 日的净资产状况，江苏华德处
于累计亏损状态，本次股权转让的定价为上述股东（包括代为持有的合计 112
名股东）于 2000 年江苏华德由集体企业改制为有限责任公司时股东实际支付的
对价。
（2）被代持人意思表示
本次股权转让方黄松泉、陈宏彬、殷玉章、陶振辉、陈旗、陈志龙、袁玉初、
陈先宏、黄灿平、顾礼萍、刘萍 11 名股东系由华德汽配于 2000 年 1 月 12 日召
开的全体股东大会选举和确定的股东代表，并且与各被代持人签署了代持协议，
约定由代持人行使股东权利。经保荐机构和发行人律师访谈112名被代持人中的
104 名被代持人（另有 8 名被代持人所持股权占江苏华德 2000 年成立时注册资
本的2.65%，因时间较久失去联系方式或其个人原因无法完成访谈并签署声明承
诺函），被代持人对代持期间代持人代为行使股东权利不存在争议、认可代持期
间江苏华德通过的全部股东会决议的内容及法律效力，未发生损害被代持人权益
的情形。
经保荐机构和发行人律师核查股权转让协议、股权转让领取股金签字表，并
访谈112 名被代持人中的 104名被代持人（另有8名被代持人所持股权占江苏华
"
128,N_A,"陈先宏、黄灿平、顾礼萍、刘萍 11 名股东系由华德汽配于 2000 年 1 月 12 日召
开的全体股东大会选举和确定的股东代表，并且与各被代持人签署了代持协议，
约定由代持人行使股东权利。经保荐机构和发行人律师访谈112名被代持人中的
104 名被代持人（另有 8 名被代持人所持股权占江苏华德 2000 年成立时注册资
本的2.65%，因时间较久失去联系方式或其个人原因无法完成访谈并签署声明承
诺函），被代持人对代持期间代持人代为行使股东权利不存在争议、认可代持期
间江苏华德通过的全部股东会决议的内容及法律效力，未发生损害被代持人权益
的情形。
经保荐机构和发行人律师核查股权转让协议、股权转让领取股金签字表，并
访谈112 名被代持人中的 104名被代持人（另有8名被代持人所持股权占江苏华
德 2000 年成立时注册资本的 2.65%，因时间较久失去联系方式或其个人原因无
法完成访谈并签署声明承诺函），确认各被代持人股权转让真实有效、股权转让
时已取得与其实际现金出资相应的转让款、对股权转让及协议的履行不存在任何
异议、纠纷或潜在纠纷，确认委托出资关系已解除，与江苏华德、发行人之间不
存在任何股权方面的争议，今后不会主张任何与股权方面的权利。
i 核查小组查阅了江苏华德出资人名录、员工股份认购书和出资人签名、
托持股协议等原始文件，确定确权范围，并采用电话、上门等方式逐个联系该等
股东，通知他们前来公司进行统一确权；
ii 核查小组对前来确权的，曾构成委托持股关系的代持股东和委托持股股
东、受让前述股东出资的陈竞宏等 5名股东、及其他不涉及代持或委托持股关系
的工商登记股东进行了面谈，全面阐述了股份确权工作的具体内容，在确权过程
中，核查小组核对了相关股东的身份证，留存了相关股东的身份证复印件和确认
函，制作了访谈笔录，对签署过程进行留影留像。
（4）核查结果
截至招股意向书签署日，核查小组共对江苏华德 2000 年成立有限公司时实
际出资的130名股东中的 122名就委托持股相关情况进行了访谈。根据持股、受
让情况，该等130名股东可分为下述四类：
类别一股东访谈情况：104名江苏华德原委托出资职工股东签署了声明确认
函，并签署了访谈笔录，确认其本人出资情况及委托出资关系的事实、股权转让
协议真实有效、股权转让时已取得与其实际现金出资相应的转让款、对股权转让
及协议的履行不存在任何异议、纠纷或潜在纠纷，确认委托出资关系已解除，与
"
129,N_A,"的工商登记股东进行了面谈，全面阐述了股份确权工作的具体内容，在确权过程
中，核查小组核对了相关股东的身份证，留存了相关股东的身份证复印件和确认
函，制作了访谈笔录，对签署过程进行留影留像。
（4）核查结果
截至招股意向书签署日，核查小组共对江苏华德 2000 年成立有限公司时实
际出资的130名股东中的 122名就委托持股相关情况进行了访谈。根据持股、受
让情况，该等130名股东可分为下述四类：
类别一股东访谈情况：104名江苏华德原委托出资职工股东签署了声明确认
函，并签署了访谈笔录，确认其本人出资情况及委托出资关系的事实、股权转让
协议真实有效、股权转让时已取得与其实际现金出资相应的转让款、对股权转让
及协议的履行不存在任何异议、纠纷或潜在纠纷，确认委托出资关系已解除，与
江苏华德、发行人之间不存在任何股权方面的争议，今后不会主张任何与股权相
关的权利。
类别二股东访谈情况：11 名江苏华德原代持股东签署了声明确认函，并签
署了访谈笔录，确认其本人出资情况及代持出资关系的事实、股权转让协议真实
有效、股权转让时已取得与其本人及被代持人实际现金出资相应的转让款、对股
权转让及协议的履行不存在任何异议、纠纷或潜在纠纷，确认代持出资关系已解
除，与江苏华德、发行人之间不存在任何股权方面的争议，今后不会主张任何与
股权相关的权利。
类别三股东访谈情况：陈竞宏等 5名股东签署了声明确认函，并签署了访谈
笔录，确认其本人出资情况及自其它股东处受让出资（含受让代持出资）的事实、
股权转让协议真实有效、股权转让时已支付与实际现金出资相应的转让款、对股
权转让及协议的履行不存在任何异议、纠纷或潜在纠纷，确认其股权为本人实际
持有，不存在代持他人或委托代持股份的情况。
类别四股东访谈情况：徐锋、钱卫霞等 2名股东签署了声明确认函，并签署
了访谈笔录，确认了出资情况、不存在代持他人或委托代持股份的情况、股权转
让协议真实有效、股权转让时已取得相应的转让款、对股权转让及协议的履行不
存在任何异议、纠纷或潜在纠纷，与江苏华德、发行人之间不存在任何股权方面
的争议，今后不会主张任何与股权相关的权利。
上述已访谈 122 名股东占江苏华德 2000 年成立时点 130 名实际出资人数的
93.85%，其所持出资（或委托出资）占江苏华德成立时注册资本总额的 97.35%。
截至招股意向书签署日，除上述122名已确权股东外，另有 8名原委托出资
"
130,N_A,"权转让及协议的履行不存在任何异议、纠纷或潜在纠纷，确认其股权为本人实际
持有，不存在代持他人或委托代持股份的情况。
类别四股东访谈情况：徐锋、钱卫霞等 2名股东签署了声明确认函，并签署
了访谈笔录，确认了出资情况、不存在代持他人或委托代持股份的情况、股权转
让协议真实有效、股权转让时已取得相应的转让款、对股权转让及协议的履行不
存在任何异议、纠纷或潜在纠纷，与江苏华德、发行人之间不存在任何股权方面
的争议，今后不会主张任何与股权相关的权利。
上述已访谈 122 名股东占江苏华德 2000 年成立时点 130 名实际出资人数的
93.85%，其所持出资（或委托出资）占江苏华德成立时注册资本总额的 97.35%。
截至招股意向书签署日，除上述122名已确权股东外，另有 8名原委托出资
股东（占股东人数的 6.15%，所持股份占股份总额的 2.65%）因时间较久失去联
系方式或其个人原因尚未完成确权。
发行人已在相关媒体上刊登公告，告知上述未能完成确权的 8名原被代持职
工股东与公司取得联系并确认其相关信息。对该等未能完成确权的人员，核查小
组核对了出资人名录、员工股份认购书和出资人签名、代持协议、股权转让领取
股金签字表等书面文件相一致，并与公司相关人员就上述被代持职工股东委托出
资、出资转让事宜进行了交叉印证访谈。
截至招股意向书签署日，不存在上述未签署声明的被代持人因上述委托持股
事项而向发行人及其实际控制人、控股股东、现任董事、监事和高级管理人员提
出异议、主张任何权利以及提起诉讼或仲裁的情形。
（5）决策程序和履行法律程序情形
基于前述代持人和被代持人之间关于股东权利行使的约定，本次股权转让经
江苏华德于 2003年 6月18日召开的股东会决议同意，各转让方分别与受让方签
署《股权转让协议》，且江苏华德于2003年 7月14日完成了该次股权转让的工
商变更登记并领取了泰州市靖江工商行政管理局换发的《企业法人营业执照》（注
册号：3212822100745）。
经保荐机构和发行人律师核查，2013年 10月9日，泰州市人民政府下发泰
政发[2013]148 号《泰州市人民政府关于对江苏华德汽配制造有限公司历次股权
变更及产权界定等事项予以确认的请示》，对江苏华德历史沿革、股权变更和产
权界定等事项发表意见如下：“江苏华德汽配制造有限公司自 1980 年设立以来
的历次改制及股权变更等有关事项履行了相关法定程序，符合当时法律法规和政
"
131,N_A,"基于前述代持人和被代持人之间关于股东权利行使的约定，本次股权转让经
江苏华德于 2003年 6月18日召开的股东会决议同意，各转让方分别与受让方签
署《股权转让协议》，且江苏华德于2003年 7月14日完成了该次股权转让的工
商变更登记并领取了泰州市靖江工商行政管理局换发的《企业法人营业执照》（注
册号：3212822100745）。
经保荐机构和发行人律师核查，2013年 10月9日，泰州市人民政府下发泰
政发[2013]148 号《泰州市人民政府关于对江苏华德汽配制造有限公司历次股权
变更及产权界定等事项予以确认的请示》，对江苏华德历史沿革、股权变更和产
权界定等事项发表意见如下：“江苏华德汽配制造有限公司自 1980 年设立以来
的历次改制及股权变更等有关事项履行了相关法定程序，符合当时法律法规和政
策规定，改制合法有效，不存在争议和潜在法律纠纷。”
经保荐机构和发行人律师核查，2014年 1月14日，江苏省人民政府办公厅
下发苏政办函（2014）2号《省政府办公厅关于确认江苏华德汽配制造有限公司
历史沿革及改制等有关事项合规性的函》，对江苏华德历史沿革、股权变更和产
权界定等事项发表意见如下：“2000 年，经资产评估和相关部门同意，靖江华
德汽车配件厂改制为江苏华德汽配制造有限公司。江苏华德汽配制造有限公司历
史沿革、股权变更和产权界定等事项履行了资产评估等相关程序，并经主管部门
批准，符合国家法律法规和政策规定。”
（6）被代持人是否拥有知情权等股东权利，相关股东权利是否得到充分保障
代持人黄松泉、陈宏彬、殷玉章、陶振辉、陈旗、陈志龙、袁玉初、陈先宏、
黄灿平、顾礼萍、刘萍系由华德汽配于 2000 年1月12日召开的全体股东大会选
举确定的股东代表，并且代持人与各被代持人签署了代持协议，明确约定由代持
人行使股东权利。
此外，经保荐机构和发行人律师访谈112名被代持人中的104名被代持人（另
有 8 名被代持人，所持股权占江苏华德 2000 年成立时注册资本的 2.65%，因时
间较久失去联系方式或其个人原因无法完成访谈并签署声明承诺函），被代持人
对代持期间代持人代为行使股东权利不存在争议、认可代持期间江苏华德通过的
全部股东会决议的内容及法律效力。
基于上述，保荐机构和发行人律师认为，代持人根据代持协议行使包括股东
知情权在内的股东权利，不存在侵犯被代持人（股权真实拥有人）股东权利的情
"
132,N_A,"黄灿平、顾礼萍、刘萍系由华德汽配于 2000 年1月12日召开的全体股东大会选
举确定的股东代表，并且代持人与各被代持人签署了代持协议，明确约定由代持
人行使股东权利。
此外，经保荐机构和发行人律师访谈112名被代持人中的104名被代持人（另
有 8 名被代持人，所持股权占江苏华德 2000 年成立时注册资本的 2.65%，因时
间较久失去联系方式或其个人原因无法完成访谈并签署声明承诺函），被代持人
对代持期间代持人代为行使股东权利不存在争议、认可代持期间江苏华德通过的
全部股东会决议的内容及法律效力。
基于上述，保荐机构和发行人律师认为，代持人根据代持协议行使包括股东
知情权在内的股东权利，不存在侵犯被代持人（股权真实拥有人）股东权利的情
形；经核查，除已在意向书等文件中披露的信息外，江苏华德的历次股权清理和
股权转让，不存在其他纠纷和潜在纠纷，相关信息已充分披露。
项核查中，对部分无法取得联系股东的权益
①原始文件核查、媒体公告及交叉印证访谈
2003 年通过股权转让方式清理股权代持，其中 8 名被代持人（所持股权占
江苏华德 2000 年成立时注册资本的 2.65%）因时间较久失去联系方式或其个人
原因无法完成访谈并签署声明承诺函。因此，发行人已在相关媒体（全国性的农
民日报和地方性的江苏经济报）上刊登公告，告知上述 8名被代持人与公司取得
联系并确认其相关信息。此外，对该 8名被代持人，保荐机构和发行人律师核对
出资人名录、员工股份认购书和出资人签名、代持协议、股权转让领取股金签字
表等书面文件，并访谈上述 8名被代持人之相应股权代持人，确认该 8名被代持
人的出资、代持以及转让事实，转让代持股份已经被代持人同意，被代持人已收
到全部股权转让款，与代持人之间不存在任何与代持股份相关的法律纠纷或潜在
法律纠纷。
②实际控制人的承诺
发行人实际控制人陈竞宏于 2014年12 月及2016年2月分别出具《承诺函》
承诺：截至《承诺函》出具日，江苏华德职工委托持股解除行为不存在权属纠纷
或潜在风险。今后如因职工委托持股解除导致任何权属纠纷或潜在风险，本人自
愿承担相应民事赔偿责任，如因上述事项导致发行人承担相关赔偿责任的，本人
将全额补偿发行人因此受到的全部经济损失。
③设立专门应急小组
发行人设立了以总经理葛江宏、董事会秘书和财务总监许霞为主的专门应急
小组，以应对和处理上述未能取得联系被代持人可能发生的问题，如当该等被代
"
