页码,表格,纯文本
372,N_A,"款占比均在95%左右，账龄一年以上的占比很低。公司一年以内应收款项坏账准
备计提比例和同行业上市公司水平完全一致。因此，公司坏账准备计提水平与同
行业上市公司并无重大差异。
②公司主要应收款项均为处于信用期限内的正常应收款项，公司应收款项回
收情况良好。2013 年度、2014年度、2015年度和 2016年1-6月，公司应收账款
周转率分别为9.18 次/年、6.70次/年、6.30 次/年和3.45次/年，公司应收账款信
用期限平均为 60 天以内，公司应收账款周转情况和信用期限吻合。公司应收账
款回收情况良好。
③报告期内，发行人未发生实际坏账损失。
发行人管理层认为，公司坏账准备政策符合公司的信用政策及公司实际经营
情况，且与同行业公司的会计政策基本一致，坏账政策符合谨慎性原则。
（2）存货跌价准备
报告期内，公司存货跌价准备情况详见本节之存货分析部分的有关内容。
（3）金融资产减值
报告期内，公司持有金融资产系对江苏靖江农村商业银行股份有限公司 200
万元投资，作为可供出售金融资产列报。报告期内，该等金融资产不存在减值情
况。
（4）固定资产减值准备
报告期内，公司固定资产未发现有明显的减值迹象，故未计提减值准备。
（5）在建工程减值准备
报告期内，公司在建工程未发现有明显的减值迹象，故未计提减值准备。
（6）无形资产减值准备
公司无形资产主要为土地使用权，报告期内不存在收回金额低于账面价值的
情形，无需计提减值准备。
综上所述，公司管理层认为：公司资产结构合理，财务政策稳健，各项资产
减值准备提取充分，与公司资产的实际质量状况相符，资产运营效率保持在同行
业正常水平，资产质量良好。
（二）负债结构分析
报告期内，公司负债主要为流动负债，明细如下：


报告期内，公司负债总额与资产规模、销售规模保持在相对稳定水平，没有
出现大幅波动，体现了公司控制负债经营，保持财务稳健性的能力。报告期内，
为了应对客户日益增长的市场需求，把握住行业发展的黄金机遇，公司亟需扩大
生产规模，进行生产设备投资，资金需求较大。另一方面公司业务规模扩张也体
现在对流动资产的需求快速增长，仅靠内部积累尚不能满足扩张节奏，因此公司
于报告期内增加了流动负债以配合营运资金的管理。
报告期内，公司流动负债主要由短期借款、应付账款构成。
（1）短期借款
报告期内，随着公司生产经营规模的扩大，对营运资金的需求相应增加，公
"
373,N_A,"业正常水平，资产质量良好。
（二）负债结构分析
报告期内，公司负债主要为流动负债，明细如下：


报告期内，公司负债总额与资产规模、销售规模保持在相对稳定水平，没有
出现大幅波动，体现了公司控制负债经营，保持财务稳健性的能力。报告期内，
为了应对客户日益增长的市场需求，把握住行业发展的黄金机遇，公司亟需扩大
生产规模，进行生产设备投资，资金需求较大。另一方面公司业务规模扩张也体
现在对流动资产的需求快速增长，仅靠内部积累尚不能满足扩张节奏，因此公司
于报告期内增加了流动负债以配合营运资金的管理。
报告期内，公司流动负债主要由短期借款、应付账款构成。
（1）短期借款
报告期内，随着公司生产经营规模的扩大，对营运资金的需求相应增加，公
司根据自身偿债能力，灵活选择筹资方式，为了节约融资成本，更多地采用短期
借款筹集资金。报告期内公司主营业务持续发展，良好的经营性现金流量为偿还
到期债务提供了充足保障，公司未有逾期银行借款，信用状况良好，融资能力较
强，公司流动负债水平处于合理范围内。
截至2016年6 月30日的借款明细如下：
（2）应付票据
报告期内，公司应付票据均为银行承兑汇票，主要是公司在采购原材料时通
过银行承兑汇票结算产生，2013 年末、2014 年末、2015 年末及 2016 年 6 月末
应付票据余额分别为 5,930万元、13,420万元、17,200万元和14,080 万元。随着
公司业务规模的扩大，采购规模持续增长，为了配合应收账款收款期限，保持财
务收支平衡，公司充分利用银行给予公司的授信额度，综合采用票据背书及开具
银行承兑汇票方式满足公司规模扩大对资金的需求。
（3）应付账款
公司应付账款主要系应付材料款、工程款、设备款、加工费和运输费。2013
年末、2014 年末、2015 年末及 2016 年 6 月末应付账款余额分别为 61,939.44 万
元、69,469.37万元、68,585.69万元和72,215.08 万元。报告期内，随公司业务规
模的扩大，应付账款逐期增长，一方面系由于产品销量增加，原材料、辅料及加
工费采购规模相应增大；另一方面系公司为扩充产能购置生产线及各地工厂建设
导致应付账款增长。公司应付账款规模与公司业务发展相适应。
报告期内，公司应付账款明细如下：

6年6月末，公司应付账款前五名情况如下
报告期内，公司主要原材料和能源采购的数量及价格情况、对主要供应商的
"
374,N_A,"银行承兑汇票方式满足公司规模扩大对资金的需求。
（3）应付账款
公司应付账款主要系应付材料款、工程款、设备款、加工费和运输费。2013
年末、2014 年末、2015 年末及 2016 年 6 月末应付账款余额分别为 61,939.44 万
元、69,469.37万元、68,585.69万元和72,215.08 万元。报告期内，随公司业务规
模的扩大，应付账款逐期增长，一方面系由于产品销量增加，原材料、辅料及加
工费采购规模相应增大；另一方面系公司为扩充产能购置生产线及各地工厂建设
导致应付账款增长。公司应付账款规模与公司业务发展相适应。
报告期内，公司应付账款明细如下：

6年6月末，公司应付账款前五名情况如下
报告期内，公司主要原材料和能源采购的数量及价格情况、对主要供应商的
采购情况参见本招股意向书“第六节 业务与技术”之“四、发行人主营业务情
况”之“（五）公司的采购与供应情况”。
截至 2016 年 6 月 30 日，公司无应付持有公司 5%（含 5%）以上表决权股
份的股东款项情况，报告期内公司应付其他关联方款项情况参见本招股意向书
第七节 同业竞争与关联交易”之“三、（二）4、报告期内发行人与关联方往来
余额情况”。
公司的应付账款主要为应向原材料供应商、外协加工单位、设备供应商、建
筑工程单位和物流商支付的采购款，主要为国内采购，各类业务的付款政策如下：
公司应付账款金额较大，主要原因是公司与各类供应商建立了长期良好的关
系，获得了较高的商业信用。公司开展业务需要的材料品种较多，供应商数量也
较多，公司根据采购业务的实际情况及相关供应商过往的合作情况在合同中约定
付款政策，对材料、外协和物流供应商不预付款项，需在开票一定时间后再支付
应付款。设备采购安装、建筑工程合同通常约定的款项有预付款、进度款、结算
款、余款和质保金，因而在报告期末公司账面上形成了较大金额的应付账款。
报告期内，公司应付账款按业务类型分明细如下：


由上表可见，报告期内，发行人应付账款余额由 61,939.44 万元增长到
72,215.08万元，其中应付工程设备款由 6,217.69 万元增长到16,006.95 万元，主
要原因系按报告期内，为了解决产能瓶颈，弥补供需缺口，发行人进行了较大规
模的固定资产投资，在武汉、广州、靖江总部城北园区等地购置了自动化冲压线
和焊接机器人，此外募投项目也已先行建设，但按照付款政策尚未达到付款条件，
"
375,N_A,"较多，公司根据采购业务的实际情况及相关供应商过往的合作情况在合同中约定
付款政策，对材料、外协和物流供应商不预付款项，需在开票一定时间后再支付
应付款。设备采购安装、建筑工程合同通常约定的款项有预付款、进度款、结算
款、余款和质保金，因而在报告期末公司账面上形成了较大金额的应付账款。
报告期内，公司应付账款按业务类型分明细如下：


由上表可见，报告期内，发行人应付账款余额由 61,939.44 万元增长到
72,215.08万元，其中应付工程设备款由 6,217.69 万元增长到16,006.95 万元，主
要原因系按报告期内，为了解决产能瓶颈，弥补供需缺口，发行人进行了较大规
模的固定资产投资，在武汉、广州、靖江总部城北园区等地购置了自动化冲压线
和焊接机器人，此外募投项目也已先行建设，但按照付款政策尚未达到付款条件，
因此导致工程设备款增加较多。而材料款、加工费、运输费用三类应付账款余额
基本保持平稳。
发行人报告期各期末应付材料款、加工费及工程设备款各期前五名供应商金
额如下：
应付材料款：
（4）预收账款
公司对已经建立长期合作关系的客户一般采用赊销方式结算，并给予 60 天
左右的信用期。预收账款的形成主要由于对部分模具业务客户采用预收货款的方
式结算。2013年末至2016年6月末，公司预收账款余额分别为91.97万元、1,750.57
万元、1,312.30万元和 1,647.52万元，占总负债的比重较小。
（5）应付职工薪酬
2013 年末、2014 年末、2015 年末及 2016 年 6 月末公司应付职工薪酬余额
分别为 1,850.11 万元、2,259.87 万元、2,516.82 万元和 1,921.53 万元。公司的应
付职工薪酬主要为已计提未发放的月度、绩效工资或奖金、津贴等，报告期末应
付职工薪酬变动主要是因为：（1）报告期内员工人数增加；（2）社会整体薪资
水平有所上升，员工的工资水平上升；（3）公司经营业绩逐年增长，年度末员
工的绩效工资随之增加。
（6）应交税费
报告期各期末，公司应交税费余额分别为 2,092.85 万元、2,045.96 万元、
4,155.49万元和3,046.48 万元，应交税费主要系应交增值税、企业所得税等。报
告期内应交税费变动主要原因为公司业务规模扩大引起增值税销项税增加，以及
供应商与公司实际结算情况引致的进项税变动等原因。2016 年 6 月末应交企业
"
376,N_A,"分别为 1,850.11 万元、2,259.87 万元、2,516.82 万元和 1,921.53 万元。公司的应
付职工薪酬主要为已计提未发放的月度、绩效工资或奖金、津贴等，报告期末应
付职工薪酬变动主要是因为：（1）报告期内员工人数增加；（2）社会整体薪资
水平有所上升，员工的工资水平上升；（3）公司经营业绩逐年增长，年度末员
工的绩效工资随之增加。
（6）应交税费
报告期各期末，公司应交税费余额分别为 2,092.85 万元、2,045.96 万元、
4,155.49万元和3,046.48 万元，应交税费主要系应交增值税、企业所得税等。报
告期内应交税费变动主要原因为公司业务规模扩大引起增值税销项税增加，以及
供应商与公司实际结算情况引致的进项税变动等原因。2016 年 6 月末应交企业
所得税增加系因发行人高新技术企业资格正在重新认定，现处于待审核阶段，因
此2016年1-6月暂按 25%的企业所得税税率计算应交所得税。
公司管理层认为，报告期各期末公司应交税金余额的波动，是因经营规模扩
大、盈利水平增长、设备投资增加、适用税率等变化引致的，是合理正常的。
（7）其他应付款
其他应付款系公司代扣职工社保公积金或收取的保证金等款项，2013年末、
2014 年末、2015 年末及 2016 年 6 月末，其他应付款余额分别为 211.90 万元、
82.18万元、72.09万元和 62.52万元。
报告期内，公司其他应付款账龄如下：

截至2016年6 月30日，其他应付款中不含应付持有公司 5%以上（含 5%）
表决权股份的股东款项和关联方单位的款项。
（8）递延收益
报告期内，公司递延收益主要为与资产相关的政府补助所形成，具体情况如
下：
根据靖江市财政局、商务局下发的靖财工贸[2013]25 号文件，公司 2013 年
收到与固定资产投资相关的专项资金 200万元，根据海宁市人民政府下发的海政
发[2013]47 号文件，海宁宏华 2015 年收到与固定资产投资相关的专项资金 243
万元，根据靖江市科学技术和知识产权局、财政局下发的靖科[2015]78 号文件，
公司 2015 年收到与固定资产投资相关的专项资金 55.27 万元，上述资金计入递
延收益，并根据《企业会计准则》的规定，公司在固定资产开始折旧时按照固定
资产的折旧年限进行平均摊销。
（三）偿债能力分析
"
377,N_A,"报告期内，公司递延收益主要为与资产相关的政府补助所形成，具体情况如
下：
根据靖江市财政局、商务局下发的靖财工贸[2013]25 号文件，公司 2013 年
收到与固定资产投资相关的专项资金 200万元，根据海宁市人民政府下发的海政
发[2013]47 号文件，海宁宏华 2015 年收到与固定资产投资相关的专项资金 243
万元，根据靖江市科学技术和知识产权局、财政局下发的靖科[2015]78 号文件，
公司 2015 年收到与固定资产投资相关的专项资金 55.27 万元，上述资金计入递
延收益，并根据《企业会计准则》的规定，公司在固定资产开始折旧时按照固定
资产的折旧年限进行平均摊销。
（三）偿债能力分析
报告期内，公司的流动比率和速动比率略有下降。近年来，公司保持较快增
长速度，为产能扩充购置了生产线并启动各地工厂扩建，另一方面，公司主要采
用流动负债如短期借款、应付账款筹集营运资金，各报告期末流动负债均占负债
总额比例的99%以上。
公司主要客户大多为信用优良的整车、发动机生产企业，并且公司以订单安
排采购、生产活动，公司与主要客户和主要供应商的结算方式、付款周期均比较
报告期内，公司的流动比率和速动比率略有下降。近年来，公司保持较快增
长速度，为产能扩充购置了生产线并启动各地工厂扩建，另一方面，公司主要采
用流动负债如短期借款、应付账款筹集营运资金，各报告期末流动负债均占负债
总额比例的99%以上。
公司主要客户大多为信用优良的整车、发动机生产企业，并且公司以订单安
排采购、生产活动，公司与主要客户和主要供应商的结算方式、付款周期均比较
稳定，公司发生短期结构性偿债风险的可能性较小。本次发行融资后，流动比率
和速动比率将有较大提高。
2013 年末至 2016 年 6 月末，公司资产负债率（母公司）分别为 52.45%、
53.56%、49.68%和 52.32%，保持稳定趋势。
报告期内，公司利息保障倍数保持在较高的水平，息税折旧摊销前利润持续
增长，公司偿债能力较强。
2、同行业可比上市公司偿债能力对比


注：上表数据系根据可比上市公司年报或招股意向书中财务报表数据计算
由上表可见，与同行业可比上市公司相比，报告期内公司流动比率、速动比
率较低，资产负债率较高，主要是由于同行业可比上市公司首次公开发行股票募
集资金到位后，自有资金较为充裕，因此较少运用杠杆工具，导致流动负债相对
"
378,N_A,"稳定，公司发生短期结构性偿债风险的可能性较小。本次发行融资后，流动比率
和速动比率将有较大提高。
2013 年末至 2016 年 6 月末，公司资产负债率（母公司）分别为 52.45%、
53.56%、49.68%和 52.32%，保持稳定趋势。
报告期内，公司利息保障倍数保持在较高的水平，息税折旧摊销前利润持续
增长，公司偿债能力较强。
2、同行业可比上市公司偿债能力对比


注：上表数据系根据可比上市公司年报或招股意向书中财务报表数据计算
由上表可见，与同行业可比上市公司相比，报告期内公司流动比率、速动比
率较低，资产负债率较高，主要是由于同行业可比上市公司首次公开发行股票募
集资金到位后，自有资金较为充裕，因此较少运用杠杆工具，导致流动负债相对
较少，各种财务指标得到了较大改善。
近年来，公司业务保持较快增长，产销规模迅速扩大，使得公司对流动资金
的需求量逐年增加，公司以债务融资为主，且短期负债增长较快，存在一定的短
期偿债压力。同时报告期内公司新设子公司、购买生产设备，非流动资产支出较
大，导致公司流动比率和速动比率较低。上述比率相对较低，是公司快速发展期
的阶段性现象。
由于公司生产规模不断扩大，流动资金需求量较大，单靠自身积累难以满足
公司发展之需，受融资渠道限制，现阶段银行贷款成为公司的主要资金来源。本
次公开发行股票募集资金后将在大幅降低公司资产负债率的同时提高公司的持
续融资能力，并增强公司偿债能力，改善公司财务结构。
管理层分析认为，公司有较强的偿债能力，主要分析如下：
（1）公司经营状况良好，具有较强的盈利能力。公司营业收入和利润持续
稳定增长，货款回收良好，为公司债务偿付提供了有力的保障。
（2）公司具备较强的现金创造能力，目前主营业务和经营活动产生的现金
净流量状况良好，营运资金充足。公司近三年及一期经营活动现金流量净额达到
87,595.02万元，公司偿债能力有较好的现金流保证。
（3）从银行信用上看，公司资信良好，同各贷款银行有着良好的合作关系
并保持较高的授信额度，融资渠道畅通。
（4）报告期内公司一直保持较高的利息保障倍数，因此公司一直有足够利
润和现金用以支付到期贷款本金和利息，无逾期还贷的情况。
综上，良好的经营状况、充足的营运资金以及可用的银行授信额度为公司偿
付债务提供了坚实的资金基础，公司的偿债风险较小。公司在未来运营和投资活
"
379,N_A,"稳定增长，货款回收良好，为公司债务偿付提供了有力的保障。
（2）公司具备较强的现金创造能力，目前主营业务和经营活动产生的现金
净流量状况良好，营运资金充足。公司近三年及一期经营活动现金流量净额达到
87,595.02万元，公司偿债能力有较好的现金流保证。
（3）从银行信用上看，公司资信良好，同各贷款银行有着良好的合作关系
并保持较高的授信额度，融资渠道畅通。
（4）报告期内公司一直保持较高的利息保障倍数，因此公司一直有足够利
润和现金用以支付到期贷款本金和利息，无逾期还贷的情况。
综上，良好的经营状况、充足的营运资金以及可用的银行授信额度为公司偿
付债务提供了坚实的资金基础，公司的偿债风险较小。公司在未来运营和投资活
动中，将结合宏观经济发展状况、行业周期、市场状况以及项目的预期回报，根
据本公司理想的资本结构来对资金来源进行组合及分配，并寻求低成本资金，同
时确保财务杠杆比例保持在适当的范围。本次募集资金到位后，公司偿债能力将
进一步得到提升。
（四）资产周转能力分析
1、应收账款周转率分析
报告期内，公司的应收账款周转率与同行业可比上市公司对比情况如下：

据可比上市公司年报或招股意向书中财务报表数
报告期内，公司实际应收账款周转率维持在约 6-9次/年左右的水平，近三年
的应收账款周转率保持稳定，高于同期同行业可比上市公司的平均水平。
报告期内，公司一年以内的应收账款占到绝大多数，占比均在 95%-99%左
右，应收账款账龄情况请参考本节“一、（一）资产结构分析”之“1、流动资
产分析”，公司应收账款回收情况良好，到期应收款能够及时收回，各期应收账
款的账龄比重基本保持在一致的水平，未发生重大坏账损失。

注：上表数据系根据可比上市公司年报或招股意向书中财务报表数据计算。
经对比，公司的存货周转率与同行业可比上市公司相近。存货周转率与业务
流程密切相关，自原材料入库到产品确认销售历经以下环节：公司原材料入库—
投入生产—生产出产成品—产成品下线后在自有库存放或者运至外库—到达外
库后，客户根据生产进度随时取用—客户领用后在下一个对账日与发行人就对账
期间领用产品品种、数量、价格等核对，双方确认无误后公司确认销售收入并开
发票。存货周转周期约为 3～5个月。
报告期内，公司根据客户提供的订单情况合理安排原材料的采购规模、生产
进度以及发货时间，减少原材料和产成品的库存时间。公司通过 ERP管理系统，
"
380,N_A,"款的账龄比重基本保持在一致的水平，未发生重大坏账损失。

注：上表数据系根据可比上市公司年报或招股意向书中财务报表数据计算。
经对比，公司的存货周转率与同行业可比上市公司相近。存货周转率与业务
流程密切相关，自原材料入库到产品确认销售历经以下环节：公司原材料入库—
投入生产—生产出产成品—产成品下线后在自有库存放或者运至外库—到达外
库后，客户根据生产进度随时取用—客户领用后在下一个对账日与发行人就对账
期间领用产品品种、数量、价格等核对，双方确认无误后公司确认销售收入并开
发票。存货周转周期约为 3～5个月。
报告期内，公司根据客户提供的订单情况合理安排原材料的采购规模、生产
进度以及发货时间，减少原材料和产成品的库存时间。公司通过 ERP管理系统，
加强精细化管理，通过与主机厂客户的信息联动，加强存货管理，降低存货备货
稳步提高存货周转水平，具有较高的存货管理能力。
（五）盈利能力分析
报告期内，公司经营情况如下表所示：

报告期内，公司营业收入主要来源于主营业务收入即汽车零部件及模具的生
产和销售，2013年营业收入为 206,310.03万元，增幅为 35.68%，2014 年营业收
入为222,595.11万元，增幅为 7.89%。
2015 年，我国汽车产业呈现“低增速新常态”的新特点，当年汽车产销分
别完成2,450.33万辆和 2,459.76万辆，创历史新高，连续第 7年蝉联全球第一，
产销量比2014年分别增长 3.25%和4.68%，但产销增速比 2014年分别下降 4.01
个百分点和2.18个百分点。公司部分主要客户的市场销量出现下滑或零增长（微
增长）。2015年公司营业收入为 236,935.81 万元，较2014年同期增长 6.44%。
2016年1-6月，继续受小排量乘用车购置税减半政策等因素影响，我国汽车
产销分别完成1,289.2 万辆和1,283万辆，同比分别增长 6.47%和8.14%，增长率
高于2015年同期3.83 和6.71个百分点（2015 年1-6月我国汽车产销同比增长率
为2.64%、1.43%），2016年1-6月公司营业收入为124,129.19万元，较 2015年
同期增长 15.14%。报告期内公司营业收入变动情况与乘用车市场供求情况基本
相符。
报告期内，公司的其他业务收入主要为边角料销售收入，板材冲压环节会产
"
